{
  "configurationId": "cfg_home_bundled_fallback",
  "schemaVersion": "2.0.0",
  "revision": 1,
  "status": "published",
  "environment": "development",
  "publishedAt": "2026-09-21T00:00:00.000Z",
  "createdAt": "2026-09-21T00:00:00.000Z",
  "updatedAt": "2026-09-21T00:00:00.000Z",
  "cache": {
    "maxAgeSeconds": 300
  },
  "platformConstraints": {
    "minAppVersion": {
      "ios": "1.5.65",
      "android": "0.8.8"
    }
  },
  "theme": {
    "tokens": {
      "surface.default": {
        "light": "#FFFFFF",
        "dark": "#1D1B18"
      },
      "surface.transparent": {
        "light": "transparent",
        "dark": "transparent"
      },
      "surface.info": {
        "light": "#E9F0FF",
        "dark": "#17293D"
      },
      "actioncenter.kyc.background": {
        "light": "#ECF1FF",
        "dark": "#17293D"
      },
      "actioncenter.kyc.border": {
        "light": "#356FFF",
        "dark": "#5B8CFF"
      },
      "actioncenter.text.secondary": {
        "light": "#505050",
        "dark": "#D1D1D1"
      },
      "banner.fastag.background": {
        "light": "#FFF8F2",
        "dark": "#33241B"
      },
      "banner.rewards.background": {
        "light": "#F3F0FF",
        "dark": "#29213D"
      },
      "banner.recharge.background": {
        "light": "#EAF8FF",
        "dark": "#173342"
      },
      "surface.warning": {
        "light": "#FFF1E8",
        "dark": "#3A2410"
      },
      "surface.accent": {
        "light": "#FDEDEC",
        "dark": "#3A1F1C"
      },
      "surface.success": {
        "light": "#E4F3EC",
        "dark": "#132A20"
      },
      "surface.critical": {
        "light": "#F6E3E5",
        "dark": "#301418"
      },
      "text.primary": {
        "light": "#1D1B18",
        "dark": "#FFFFFF"
      },
      "text.onAccent": {
        "light": "#FFFFFF",
        "dark": "#FFFFFF"
      }
    }
  },
  "appIcons": {
    "defaultIconId": "ic_launcher",
    "supportedIconIds": [
      "ic_launcher",
      "ic_launcher_ny",
      "ic_launcher_26",
      "ic_launcher_ind",
      "ic_launcher_chris"
    ],
    "timeZone": "Asia/Kolkata",
    "campaigns": [
      {
        "id": "new_year",
        "iconId": "ic_launcher_ny",
        "startDate": "2025-12-31",
        "endDate": "2026-01-02",
        "priority": 10
      },
      {
        "id": "republic_day",
        "iconId": "ic_launcher_26",
        "startDate": "2026-01-25",
        "endDate": "2026-01-27",
        "priority": 10
      },
      {
        "id": "independence_day",
        "iconId": "ic_launcher_ind",
        "startDate": "2026-08-14",
        "endDate": "2026-08-16",
        "priority": 10
      },
      {
        "id": "christmas",
        "iconId": "ic_launcher_chris",
        "startDate": "2026-12-24",
        "endDate": "2026-12-26",
        "priority": 10
      }
    ]
  },
  "navigation": {
    "bottom": [
      {
        "id": "home",
        "label": {
          "kind": "literal",
          "value": "Home"
        },
        "icon": {
          "kind": "remote",
          "url": "https://uat1.omnicard.co.in/file-utils/ZhYwcpaw.png"
        },
        "actionId": "home"
      },
      {
        "id": "cards",
        "label": {
          "kind": "literal",
          "value": "My Cards"
        },
        "icon": {
          "kind": "remote",
          "url": "https://uat1.omnicard.co.in/file-utils/CUpe2MFQ.png"
        },
        "actionId": "cards"
      },
      {
        "id": "scan_pay",
        "label": {
          "kind": "literal",
          "value": "Scan & Pay"
        },
        "icon": {
          "kind": "remote",
          "url": "https://uat1.omnicard.co.in/file-utils/Fsv9GK4e.png"
        },
        "actionId": "scan_pay",
        "variant": "elevatedCenter"
      },
      {
        "id": "reports",
        "label": {
          "kind": "literal",
          "value": "Reports"
        },
        "icon": {
          "kind": "bundled",
          "name": "reports"
        },
        "actionId": "reports",
        "audience": {
          "all": [
            {
              "field": "user.type",
              "operator": "in",
              "value": [
                "B2B"
              ]
            }
          ]
        }
      },
      {
        "id": "rewards",
        "label": {
          "kind": "literal",
          "value": "Rewards"
        },
        "icon": {
          "kind": "bundled",
          "name": "rewards"
        },
        "actionId": "rewards",
        "audience": {
          "all": [
            {
              "field": "user.type",
              "operator": "in",
              "value": [
                "B2C"
              ]
            }
          ]
        }
      },
      {
        "id": "history",
        "label": {
          "kind": "literal",
          "value": "History"
        },
        "icon": {
          "kind": "remote",
          "url": "https://uat1.omnicard.co.in/file-utils/4ulPZyf4.png"
        },
        "actionId": "history"
      }
    ]
  },
  "screens": [
    {
      "screenId": "home",
      "title": "Home",
      "style": {
        "backgroundToken": "surface.default",
        "statusBarStyle": "auto"
      },
      "components": [
        {
          "componentId": "header",
          "type": "header",
          "componentVersion": 1,
          "enabled": true,
          "style": {
            "backgroundToken": "surface.transparent"
          },
          "props": {
            "nameField": "userName",
            "profileImageField": "userProfileImage",
            "rightActions": [
              {
                "id": "search",
                "icon": {
                  "kind": "remote",
                  "url": "https://uat1.omnicard.co.in/file-utils/0pkym3y9.png"
                },
                "actionId": "open_search"
              },
              {
                "id": "notifications",
                "icon": {
                  "kind": "remote",
                  "url": "https://uat1.omnicard.co.in/file-utils/kAbVfN2u.png"
                },
                "actionId": "open_notifications",
                "badgeCountField": "unreadNotificationCount"
              }
            ],
            "subDetails": {
              "variants": [
                {
                  "audience": {
                    "all": [
                      {
                        "field": "user.type",
                        "operator": "in",
                        "value": [
                          "B2B"
                        ]
                      }
                    ]
                  },
                  "textType": "plain_text",
                  "valueBinding": {
                    "kind": "binding",
                    "path": "user.enterpriseName",
                    "fallback": ""
                  }
                },
                {
                  "audience": {
                    "all": [
                      {
                        "field": "user.type",
                        "operator": "in",
                        "value": [
                          "B2C"
                        ]
                      }
                    ]
                  },
                  "textType": "badge",
                  "valueBinding": {
                    "kind": "binding",
                    "path": "user.planName",
                    "fallback": ""
                  },
                  "icon": {
                    "kind": "bundled",
                    "name": "upgrade_badge"
                  },
                  "actionId": "open_plan_details"
                }
              ]
            }
          }
        },
        {
          "componentId": "quick_actions",
          "type": "quickActions",
          "componentVersion": 1,
          "enabled": true,
          "style": {
            "backgroundToken": "surface.default"
          },
          "layout": {
            "orientation": "horizontal",
            "viewType": "fixed",
            "columns": 4
          },
          "props": {
            "title": {
              "kind": "literal",
              "value": "Quick Actions"
            },
            "topItems": [
              {
                "id": "check_balance",
                "label": {
                  "kind": "literal",
                  "value": "Check Balance"
                },
                "media": {
                  "leading": {
                    "kind": "bundled",
                    "name": "balance"
                  }
                },
                "actionId": "check_balance"
              }
            ],
            "items": [
              {
                "id": "pay_anyone",
                "label": {
                  "kind": "literal",
                  "value": "Send Money"
                },
                "media": {
                  "leading": {
                    "kind": "remote",
                    "url": "https://uat1.omnicard.co.in/file-utils/v3uACLXx.png"
                  }
                },
                "actionId": "pay_anyone"
              },
              {
                "id": "scan_pay",
                "label": {
                  "kind": "literal",
                  "value": "Scan & Pay"
                },
                "media": {
                  "leading": {
                    "kind": "remote",
                    "url": "https://uat1.omnicard.co.in/file-utils/Fsv9GK4e.png"
                  }
                },
                "actionId": "scan_pay"
              },
              {
                "id": "add_money",
                "label": {
                  "kind": "literal",
                  "value": "Add Money"
                },
                "media": {
                  "leading": {
                    "kind": "bundled",
                    "name": "add_money"
                  }
                },
                "actionId": "add_money"
              },
              {
                "id": "fastag",